{
  "schema_version": "1.0",
  "cyclone_id": "CYC-2026-NIO-NULL",
  "name": "Area-of-Interest-42",
  "timestamp": "2026-09-08T06:00:00Z",
  "basin": "North Indian Ocean",
  "identification": {
    "detected": false,
    "confidence": 0.12
  },
  "classification": {
    "stage": "NO_SIGNIFICANT_SYSTEM",
    "confidence": 0.88
  },
  "intensity": {
    "level": "DEPRESSION",
    "scale": "IMD",
    "max_wind_kt": 15.0,
    "min_pressure_mb": 1008.0,
    "confidence": 0.25
  },
  "prediction": null,
  "sources": [
    "insat3d_ir",
    "era5"
  ],
  "model_version": "chakravyuh-brain-0.1",
  "tier": "tier0",
  "extra": {
    "invest_area": "92B",
    "status": "clear_no_circulation"
  }
}
