{
  "schema_version": "1.0",
  "cyclone_id": "CYC-2026-BAY-001",
  "name": "Invest-94B",
  "timestamp": "2026-09-08T06:00:00Z",
  "basin": "North Indian Ocean",
  "identification": {
    "detected": true,
    "confidence": 0.76
  },
  "classification": {
    "stage": "DEVELOPING_DISTURBANCE",
    "confidence": 0.72
  },
  "intensity": {
    "level": "DEPRESSION",
    "scale": "IMD",
    "max_wind_kt": 25.0,
    "min_pressure_mb": 1002.0,
    "confidence": 0.68
  },
  "prediction": {
    "current_position": {
      "lat": 11.20,
      "lon": 87.40
    },
    "heading_deg": 315.0,
    "speed_kt": 8.5,
    "forecast_hours": 24,
    "predicted_path": [
      {
        "t_plus_h": 0,
        "lat": 11.20,
        "lon": 87.40
      },
      {
        "t_plus_h": 6,
        "lat": 11.60,
        "lon": 87.00
      },
      {
        "t_plus_h": 12,
        "lat": 12.10,
        "lon": 86.50
      },
      {
        "t_plus_h": 24,
        "lat": 13.20,
        "lon": 85.60
      }
    ],
    "confidence": 0.65,
    "uncertainty": {
      "cone_radius_km": [
        0.0,
        55.0,
        95.0,
        160.0
      ]
    }
  },
  "sources": [
    "insat3d_ir",
    "era5",
    "ibtracs_climatology"
  ],
  "model_version": "chakravyuh-brain-0.1",
  "tier": "mixed",
  "extra": {
    "shear_kt": 12.5,
    "sst_celsius": 30.2,
    "organization_index": 0.61
  }
}
